Name,Score,Address,Reviews
타이엔,4.2,성남시 분당구 판교역로2번길 7,"아는 타이집 중에 최고||파인애플 볶음밥이랑 쌀국수 시켰는데한입에 파인애플 두개씩 씹히는 혜자 식당…적당히 탄 맛과 꼬들한 식감이 레전드였음쌀국수도 꼬소하니 맛있었는데 안좋은 후기가 많아서 놀랬네여|사진 찍힌 음식 이름 모르는데 맛있어요!|팟타이 맛 없어요 ㅠㅠ|내가 쓴 리뷰 지워짐여기 평 안좋게주면 리뷰 지우네요별로인데 이상하게 별점이 좋더라|맛은 있는데 주방에 계신분 마스크는 좀 써주세요||요리하는 사람들은 담배 핀 손으로 조리.위생 엉망맛은 없고 불친절에 주차할 곳도 없고어쩌다 주차하면 빼기도 어렵고돈이 아깝네요기분만 안 좋고|판교 가면 맨날 먹음|파인애플 볶음밥 맛있구요, 쌀국수도 맛있게 잘 먹었어요~~ 쌀국수 생각나면 와요 :)|먹어본 곳 중 먹자마자 맛없다는 소리가 입밖으로 나오긴 처음인 음식점.. 톰얌꿍은 그냥 맛이 근본이 없고 베트남쌀국수는 그나마 먹을만한데 고기가 너무 싸구려 맛.. 돈받고 먹어야됨 스피링롤도 그냥 맛없음. 그냥 여기는 베트남음식 한번도 안드셔보신 사장님이 하시는거 티남|오호!! 맛나요!!||맛나요|||깔끔하고 맛있는 베트남 쌀국수|국물류는 굿, 밥류는 약간 아쉬움|"
포레스트오늘숲 서판교점,4.7,성남시 분당구 운중로146번길 35 1층 101호,"|맛있어요~|다른 매장과 같은 메뉴 왕갈비 쌀국수를 시켰는데 여긴 갈비가 너무 마르고 질겼어요.그래도 양 많고 맛있긴 해요.왕갈비쌀국수|쉬림프스프링롤 맛집, 왕갈비쌀국수는 양이 정말 많아서 둘이 메인메뉴1+사이드1 해도 배불러요|동탄점도 좋았는데 판교점도 좋아요~직원분들 너무 친절하시고 설명도 잘해주십니다사람수대로 주문하니 양 많아서 다 못드신다고덜 시키라고 설명해주시네요 ㅎㅎ갈비 너무 맛있어요~^^||쌀국수 하나와 사이드로 둘이서 무척 배부르게 먹었습니다 :) 친절하시고 테이블 회전도 빨라요!|쌀국수 양이 많아서 둘이 가면 쌀국수 하나에 사이드를 몇개 시키는기 나을 것 같네요.|친절 깔끔해요양많고 맛있어요둘이가서 쌀국수 + 사이드 2개하면 배터짐|푸짐하고 맛있는 쌀국수집입니다.사이드메뉴는 롤 종류가 괜찮습니다.|양이 진짜 많아서 2명이서 하나 시켜도 될 정도에요|양이 많은것만 단점. 저알 맛있어요|쌀국수 양이 너무너무 많아요이곳의 강점 메뉴는 오히려 새우롤?|양 많고 맛있어요 👍||왜 웨이팅을 하나 싶었는데 그 이유를 알겠네요. 왕갈비쌀국수 양 엄청 많고 엄청 맛있어요. 갈비에 고기도 많고. 쌀국수 하나에 사이드메뉴 하나 시키면 2명도 먹겠어요. 단 식사하고 나서 물이 계속 당기더라고요. 염분이 많거나 조미료가 많거나...? 근데 너무너무 맛있었어서 충격적이었어요.||음식이 정말 맛있어요.. 정말 맛있는데... 나오는 음악이 미쳤어요... 어쩜 이렇게 쌀국수랑 찰떡같이 어울리는 노래를로만 틀어주시나요? 음악에 취해서 쌀국수가 코로 들어가는지 입으로 들어가는지 모르겠어요|양이 정말 정말 많은데 넘 맛나요!!|양 진~~~~~~~짜 많고 국물이 끝내줌|맛은 괜찮은데 갈비탕국물에 쌀국수면 넣은 느낌|맛있네요~~국물이 짙고 끝내줍니다.보통 쌀국수에 양파를 넣고 고수도 넣어 먹는데..국물의 본연 맛이 흔들릴까봐 넣지를 못했네요..그만큼이나 맛나요~|양이 진짜 많고 국물이 맛있어요||갈비탕모양 쌀국수 양이 너무 많아서 1/3먹고 나왔어요짜죠 진짜 맛있어요.쉬림프롤도 맛있구요.많이 남기고 와서 아꿉..양조금 적게 하고 가격을 내리시거나 2인 먹을양이라고 알려 주시면 좋을 것 같아요~~|맛있는데 가게분위기가 좀 별로에요...그래서 별하나깎음,,근데 음식은 약간 갈비탕맛나고 양 짱많고 존맛~! 왜 동탄에서 유명한지 알겠어요|적극추천!"
반포식스 판교역점,,성남시 분당구 판교역로192번길 12 판교미래에셋센터 2층, 
몬안베띠 정자점,4.3,성남시 분당구 정자일로 220 동양정자파라곤 1층 109호,"쌀국수보다는 볶음요리들이 맛있음 친구들 데려가면 다 맛있다구 함 가게가 작아서 대부분 웨이팅 있긴한데 그래도 갈만한 맛|평일 오픈하자마자 매장 꽉 차서 첫 타임에 들어가신분들 다 식사하고 나오시면 12시쯤 먹을 수 있네요!! 맛있고 회전률 빨라용||모든메뉴 다 맛있습니다. 특히 전 테이블마다 놓여진 고추피클이 왜이렇게 맛있던지 ㅠㅠ 팔면 사고싶을 정도...|good:좋은위치,젊은직원들위주 이며 인사잘함not good : 가성비는 떨어짐, 양은 적은편, 노출유리벽인테리어라 밖에서 다 보임(반대로 안에서도 밖이 잘 보이니..취향에따라 다를수 있음)주 고객층은 정자동 및 주변동네의 30-40대 여성들, 그녀의 자녀들, 일부 커플들 이며 이 타켓에 맞춘메뉴,인테리어,직원셋팅은 잘 되어있음.이곳에서 부족한 부분은 포메인 및 뒷편 미스타쌀국수에서 보완가능, 반대로 그 두곳에서 부족한 부분은 이곳에서 보완가능.. 3곳이 모두 장사 잘 됨. 주 고객층의 비중이 각기 다름.|앩!! 옹!! (대충 닭고기 쌀국수 매운맛 시켰는데 담백하고 끝맛이 지저분하지 않아서 좋았다는 뜻)(캡사이신 범벅의 자극적인 매운맛이 아니어서 정말 좋았다는 뜻으로도 해석 가능함)||진짜 맛있고 넘 친절하세요ㅠ매운 쌀국수가 처음 먹어본 특이한 맛인데 중독성 있고소고기볶음밥이 진짜 맛있어요ㅠㅠㅠㅠㅠㅠㅠㅠ조만간 또 먹으러 갈래요ㅜㅠㅠㅠ||처음 먹었을 때 대존맛이라고 느꼈다.근데 맛있다고 자주가면 좀 질린다.가끔씩 가줘야 만족하고 먹는 맛.맛은 있는데 가격이 싸진 않다.|프랜차이즈 쌀국수집보다맛은 10%  낫고가격은 30%  비쌉니다ㅎㅎ|기본 쌀국수 국물에 계피향이 진하네요 간이 맞는 것도 아니고 면이 맛있는 것도 아니고 니맛도 내맛도 아닌 맛입니다 제가 집에서 만들어 먹는 게 나을 정도? 로제는 진짜..아닌 것 같고 그나마 해산물볶음밥이 괜찮았는데 조개껍데기 씹었어요ㅎ 코코넛쉬림프도 그냥.. 한 입 먹고 남김.. 메뉴를 많이 시켜서 음식 나오기 전 테이블 옮겨도 되냐고 물어보니 단칼에 안 된다고 하시더라고요 주말엔 대기가 많아서 안 된다고 하시던데 대기 없던 상황이었어요ㅎ 2인테이블 정말 좁아요 참고하세요|해산물볶음밥 최고!삼겹살쌀국수, 로제해산물쌀국수 먹었는데다음에는 볶음밥 먹으러 갈 예정입니다.|차돌박이쌀국수랑 소고기볶음밥 주로 먹는데요. 옆테이블에서 로제해물쌀국수 드시는게 맛나보여서 따라 시켰는데, 약간 매콤~하면서 고소한게 이것도 별미네요. 정자에서 쌀국수는 여기가 탑!|깔끔한 외관, 무난한 쌀국수, 괜찮은 볶음밥맛있게 먹었습니다|분위기만 좋습니다 맛있기는 한데 요즘 워낙 쌀국수는 맛있는데가 많다보니 엄청난 맛집은 아니예요. 분위기 좋고 깔끔한 식당 정도입니다. 공심채는 해산물 공심채라 기대했는데 재료가 싱싱한거에 비해서 맛이 너무 짜서 별로입니다 ㅜ 게다가 직원분들도 불친절까지는 아니지만 친절하지 않아요. 전체적인 평은 깔끔한 외관에 속은 기분이랄까요…||맛있어요...|[맛 4/5] [분위기 5/5] [서비스 4/5]삼겹살 쌀국수 맛있고 볶음밥도 맛있어요. 분위기는 개인취향저격이네요. 짜조는 평균이하였습니다.|와 너무 맛있어요!!보끔밥 잊지 못해또 갈게요||수비드 삼겹 쌀국수, 짜조 다 맛이 애매해요|볶음밥이 괜찮은편. 쌀국수는 맛이 애매함|볶음밥 쌀국수 잘 먹었습니다. 깔끔하고 친절하시고 맛있네요.|볶음밥 정말 맛있음!!!!||뷰가 괜찮아요ㅎㅎ음식 맛도 좋고, 가격도 적절해서 너무 좋아요.그만큼 인기가 많아 웨이팅이 조금 있어요.|깔끔하고 맛있음"
미분당 정자점,3.2,성남시 분당구 정자일로 158 백궁프라자2 1층 111호,"23년도 댓글보고 혹시나했는데... 검은니트릴장갑끼고 걸레만지고 설거지하고 고기만지네요... 차라리 손이었다면 찝찝해서 씻기라도 하실텐데 생각이없나보군요 ㅠ 안타깝네요 댓글안보시나||쌀국수 맛있어요혼밥하기 좋은 구조|종업원이 쓰레기 꽉꽉 눌러 정리한 장갑 계속 끼고 있으셨어요. 밥먹다 속 안좋아진 적은 처음이네요 ...|||니트릴 장갑 낀 채로 영수증 정리하고 행주로 조리대 닦고 그대로 또 파 고명 담고 숙주 만지고 .. 니트릴이 무슨 항균장갑도 아니고.. 맛도 나쁘지않고 친절하신데 위생좀 신경쓰시면 좋겠어요|주방에 계신분들이 앞에서 간식같은걸 먹고 이야기해서 불편했고 주방에있는 쓰레기통보며 먹으니 비위상함 다신안갈듯|프랜차이즈 고려) 맛있고 리필가능 가격도 괜찮||맛있네요. 고기양도 많고 국물도 좋습니다|최고의 국물맛|조용히 쌀국수 먹기 좋은곳 맛은 평타 특별할건 없음||쌀국수|정말 정말 불친절함물컵이 없어서 컵 좀 달라고 몇번을 말해도 들은 척도 안하더니, 나중에야 듣고서 가져온것은 조용히 하라고 쓰여있는 종이...내앞에 보여주며 종이를 손가락으로 가리키는데 기가 막힘.필요한 것 좀 달라는데 조용히 하라니..그럼 말 안해도 될만큼 서빙을 완벽히하던지기분 나빠서 소화도 안 되는것 같음.조용한 것이 이 식당의 운영방침인 것은 잘 알겠으나 그렇다고 불친절할 필요는 없는것 아님?||맛은 있어요. 그런데 불친절도 아닌 무친절 무슨 투명 인간인줄...|맛은 있었지만 접객 태도는...할말하않||점원들이 인사해도 대꾸도 안하고 불친절하네요 맛은 있음|육수 깔끔 매콤하면서 나름 깊은 맛이난다.오픈형 주방이고 위생적이어서 기분이 좋음음식점 분위기도 조용하고 잔잔한 음악이 나와서 편안하다정자동 살면서 쌀국수 먹고 싶은 비오는 날엔 무조건 이 집 찾아갈 듯서현점도 가봤눈데... 왠지 여기가 더 맛남|맛은 있는데..... 서현점이랑 비교할때는 너무 별로에요직원분 본인이 못알아듣고선 다시 말하면 짜증내고 옆에 손님도 고수 요청하는데 아무도 안주고 한 멀리 떨어진 저도 옆에 손님 말 다섯번은 들은거 같아요.... 사장님은 다른 직원 교육 하시느냐고 정신없으시고 분위기도 서현점에 비하면 아늑함도 없고 음악소리만 시끄럽네요....|브레이크타임고지해주세요|맛있어요~~~|국물, 면발, 고명...모두 만족...제 입맛엔 간도 적당합니다^^ 늘 한산할 때 가서 그런지 혼밥 분위기도 좋아요.|서현점보다 못함..서비스도 별로|평가가 왜 높은지 모르겠음. 육수가 너무 짰음...처음엔 맛있게 느껴질지 모르나 맛있게 다 먹질 못함. 고명은 너무 질기고 맛이 없었음. ㅠ..ㅠ|사장님이 너무 친절하시고 맛있어요!!|맛잇게 잘 먹구 갑니다|쌀국수 좋아하는데 더 좋아하게 됐네요정말 맛있어요~|한번먹고 또 갈수밖에 없는 맛"
미스터쌀국수 정자점,5.0,성남시 분당구 정자일로 230,맛있어요 면도 생면같아요 야들야들 해서 좋아요국물도 깔끔합니다 추천
포하임 서현점,2.2,성남시 분당구 서현로210번길 20 코코프라자건물 105호,"쿠폰도 많이 모을만큼 갔는데 왜 쓰기전에 말을 해야하죠? 더 적게주나? 하나로 쌀국수 시키려니 안된다 그러고  제약이 너무 많으신거 아닌가 안가렵니다|과거 1층에서 영업할때 생각나서 오랫만에 찾아봤는데 맛이 예전만 못하네요.. 손님들보다 직원들 떠드는 소리가 더 시끄러워서 참, 여기는 여사장님이 매일 카운터 지킬때가 전성기였던듯ㅎㅎ|맛친절가성비 굿|예전만 못해요.. 대기하라해서 대기표 받고 대기했는데 부르지도 않아서 밖에서 기다렸네요서빙하시는 분들은 음식을 툭툭 내려놓고 가버리고..음식에서도 피쉬소스 냄새인가? 조금 시큼한 냄새가 나더라구요 1층일때는 엄청 친절하셨던것 같은데..아쉽네요ㅠㅠ|서비스 엉망👎(주방쪽에서 시끄럽게 떠들고 있었..)알바생 불친절👎 (잘못하면 사과를 안함)맛은 있음 ㅎ기분은 더럽지만 맛은 있어요 ㅎ가실 분은 가세요 ㅎㅎ|국물은 새콤이 아닌 시큼한 묵은내가 나고 볶음밥에선 신선하지않은 계란에서 나는 비린내가 심해서 절반도 못먹고 나옴|서비스란 눈을 크게 뜨고 찾아봐도 없고 들어오든지 말든지 앉든지 말든지 주문을 하든지 말든지 관심도 없고 두 번씩 말해야 가져다주고 쳐다보는 곳... 옛날 1층 생각하면서 갔는데 맛은 1층에 있을 때보다 맛이 너무 없었습니다. 1층에 있을 때는 친구들 가족들 데리고 올 정도로 쿠폰도 열심히 모았던 곳이었습니다. 줄 서서 먹는 곳이었는데 왜 줄이 없는지도 이해가 되더라고요. 사장님이 이 글을 보신다면 직원 서비스 교육은 무조건 다시 하셔야 할 것 같네요. 맛은 그렇다 쳐도 직원 서비스가 그러니 더 이상 가고 싶지도 지인들에게 추천하고 싶지도 않아졌습니다. 더 이상 방문 의사는 없으니 쿠폰은 찢어버리겠습니다.||제발 가지마세요~진짜 별한개도 아깝습니다맛도 예전에비해 변했고 남자사장님 매너 진짜 최악입니다. 장사를 안하고싶어하시는듯|여기 무난 괜찮고 맛있음서울 빈로이 없어져서 너무 슬펐는데 여기로 대리 만족하고 먹고 있음|사장님께서 키즈 메뉴는 직접 드셔보시고 바꾸심을 추천드립니다.드셔보면 알텐데... 마치 하루전날 한 밥이 밥통속에 묵혀있다가 빛을 본듯한 푸석함에 고기조차 윤기가 없어 사막과 같은 푸석함. 결국 푸석함에 푸석함을 더해 아이가 물을 엄청 먹더이다....쌀국수는 괜찮습니다.|웨이팅 중 자리뺏김.. 음식 주문 잘못들어가서 먼저 온 손님들보다 늦게받음.. 음식 왜 늦게나오냐고 여쭤봤는데 어찌된건지 다시 묻기전까지 설명 하나 없었음 대기서비스말고 서비스 하나 더 주셨는데요. 서비스 필요없으니 기본적인 응대부터 개선해주세요...|왜 손님이 많은지 이해 불가. 손님 많길래 왔는데...... 쌀국수 국물부터 실망. 팟타이는.... 일케 하얀 팟타이는 첨 봄. 그냥 간장맛이라고 팟타이 시킨 지인이 한마디함. 좀만 신경쓰면 맛집될 수 있을거 같은데...... 그래도 배는 채웠으니 눈물의 3점 ㅠㅠㅠㅠ|알바생 서비스가 너무 별로에요 완전 비추|||솔직히 맛있지는 않아요..사천쌀국수는 너무 맵네요|쌀국수|"
다채로움월남쌈,3.7,성남시 분당구 하오개로 337 1층,"예전부터 월남쌈 먹고싶으면 자주 가던 곳.맘에 드는 다양한 야채 종류+후식으로 나오는 쌀국수가 정말 맛있음|너무 맛있게 먹었습니다||오리,돼지,소고기랑 같이 월남쌈 맛있게 먹었습니다. 건물 앞에 따로 주차 가능한 공간이 있어서 좋아요|야채 많이 먹을 수 있어서 좋아요. 쌀국수도 맛있고요.|야채 많이 드시고 싶으면 가시되, 음식 질은 기대말 것-특히 고기가 구내식당 수준.후식으로 판매하는 아이스크림도 대체 얼마나 묵힌걸 파는건지 무인떨이판매점 상품만도 못함.|접객 개차반ㅋㅋ 왜 이래요?^^접시 달라니 뒤에 꺼 쓰세요! 퉁명스럽고(적어도 갔다주기 귀찮거나 바쁘면 손님, 죄송합니다만 뒤에 있는 접시 우선 쓰시겠어요?라고 말하는게 예의 아닌가요?ㅋㅋㅋㅋ 아니 정상적인 가게라면 갖다주는게 맞죠~~)여사장님인가 화장실 어디냐니 등돌아버리고_옆에 있으니 알아서 봐란 뜻인듯_젓가락 달라니 저기 직원한테 말하세요!!라고 성질내고ㅋㅋ아니 어의가 없어서ㅋㅋㅋㅋㅋ손님이 꼴보기 싫으시면 장사 접으시는게 어떠신지!! 전엔 고기리필도 됐는데 새로 바꼈다해서 와보니 맛은 똑같지만 고객 우습게 보고 고기리필 추가비용 받으니 이제 이 먼데까지 올 일 다시는 없겠네요^^영수증 달라하니 영수증도 안된다곸ㅋㅋㅋ 뭐지 이 가게....끝까지 이해 안 됨...너무 기분 나빴네요.|야채 실컷 먹고싶을 때 자주 가는 곳!|너무 배부르게 잘 먹고왔어요고수가 좀 말라있어서 많이 안먹었는데 너무 많이 주셔서 야채들 다 남기기 너무 아까웠어요..다음에는 처음부터 고수 안주셔도 된다고 해야겠어여|[쫑예딘의 양심리뷰]가게 인수전에 다른 이름으로 간게 마지막인데 상호명만 바뀌고그대로라면 추천드릴만 합니다.물론 교통편은 차가 있어야만 올 수 있다는 단점 ㅎ맛 : 괜춘서비스 : 괜춘|존맛탱|식당에서 온 가족이 도둑 취급 받았습니다. 10여 차례 방문한 단골임에도, 손님들 많은 곳에서 식당 주인이 입에 담지 못할 모욕을 주시더군요.   추가 리필 하지 않은 기본으로 나온 야채가 좀 남아서, 음식 남은것을 못 보시는 어머님이 싸서 가져가시겠다는 것을, 대놓고 경찰 신고 운운하시면서 좀도둑 취급했습니다.   추가 리필이 아니라 어차피 기본으로 나온 야채이고, 남기기 아까워하시는 어머님이 포장하여 한것이라고 몇번을 정중하게 설명드렸지만, 식당 주인은 단호하게 저희를 도둑처럼 얘기하시더군요…  음식은 맛있었지만, 다시는 가고 싶지 않습니다. 모처럼 가족끼리 외식을 하러 갔다가 온가족이 크게 실망하고 왔습니다.|주인이 바꼈는데 예전만 못한느낌.소스도 좀 종류 한정적이고고기도 뻑뻑|아초원에서 상호만 바뀌었더라고요. 대신 1인 식사비가 내렸습니다. 고기 리필은 추가요금이 생기고요. 진짜 배터지게 신선한 야채 먹을 수 있어서 너무 좋아요. 맛도 안변하고 최고|가성비 맛집입니다.각종 채소가 무한 리필이라 아주 실컷 먹고오네요ㅋ"
