Name,Score,Address,Reviews
포메인 수내점,3.0,"성남시 분당구 황새울로214번길 8 MS프라자 2층 205,206호","해물쌀국수 메뉴판 사진이랑 너무 다른거 아닌가요대하가 있겠거니 하고 주문했는데 칵테일새우가 있네요|맛있고 양도 많이 줍니다.|포메인이 체인인데도 매장마다 맛이 살짝 다른 줄을,이곳에서 먹어보고 알았네요.국물 맛이 익숙하진 않는데 그래도 제 입맛에는 좀 아닌듯 했습니다. 아내는 좋아한다고 하니 호불호가 갈리는것 같습니다.||음식이 맛있습니다^^|염색한 남자 종업원이 너무 불친절하네요 식사하기도 전에 기분이 다 안좋아지네요..|친절하고 맛있어요.|맛잇어요. 직원분도 친절하요|재난지원금 된다해서 시켰더니 안되는 코미디|적당한 월남쌈/ 쌀국수 집전형적인 포메인임"
홍대쌀국수 NC백화점 야탑점,2.3,성남시 분당구 야탑로81번길 11 지하1층,"고기쌀국수 달라니까 그냥쌀국수를 주네 만들다가 고기흘렸는지 쥐콩만하게 라면고기만하게있네|겁나빨리나옴|이름은 홍대쌀국수인데 일하는 사람은 동남아 외노자들뿐. 그래서 한국말 못 알아먹는건 기본. 못 알아먹는건지, 알아듣고도 반말로 찍찍 내뱉는건지 어휴... 게다가 음식은 대충 만들다만 느낌. 이런애들한테 내국인 기준의 최저임금시급을 주는건가요??|가끔 국물이 물 많이 탄듯 싱거울 때가 꽤 된다"
홍대쌀국수 이마트분당점,3.3,성남시 분당구 불정로 134 3층,주방직원이 외국인들같은데 마스크도 안쓰고 밥만들면서 음식에 침들어가게 계속 떠들면서 만듬..더러워요|여기가 먹어본곳중에최고임||가성비는 굿|가성비가 좋습니다. 쌀국수 국물도 진한 편입니다.||직원분이 너무 불친절해요.. 웬만하면 가게 후기들 다 좋게 남기는데 기분만 상하고 왔어요
포메인 분당오리역점,2.4,"성남시 분당구 성남대로 51 분당포스빌오피스텔 1층 165,166호","|지나가다 냄새에 끌려 들어 갔는데 시간을 되돌려 내 멍청한 코를 때려 버리고 싶다. 프리미엄 소고기가 이렇게 퍼석퍼석한... 국수면은 툭툭 끊겨 있다. 먹기 좋게 가위질이라도 해주신 줄... 이게 15500이라니, 냉면 한그릇에 18000원이라 해도 봉피양은 혜자임에 틀림 없다. 별 하나 주고 싶은데 그래도 친절해서 2개 던진다.|맛은 체인이라 뭐 아는맛인데친절하셨습니다.|포메인 닭고기 볶음밥을 아이들이 좋아해서 거의 10년간 단골메뉴인데, 주인 바뀐 이후로 어느날 가서 시켰더니 닭고기 볶음밥에 야채만 있고 닭고기는 거의 없네요. 있어도 야채크기만한 몇개. 원래는 큼지막한 뭉터기 고기가 있어야 하는데. 재료 아끼는 음식점은 꽝!|너무 맛나요 친절하시고|메뉴 3개 시켜 다 실패함||옆에 좀만 가면 베트남 쌀국수 4500원짜리 있는데, 이게 9500원이라니... 양도 적고, 맛도 다를거 없는데, 왜 이렇게 비싼지 이해 불가. 서비스가 그만큼 좋으면 이해할텐데 그것도 아님. 먹어도 배고픈 9.5 음식은 처음이다."
포아델,3.9,성남시 분당구 구미로 191 1층 103호,"몇년전 주인바뀌고 갔을때 고명으로 얹은 견과류에서 쩐내가 난 이후 한~동안 안갔다가 등산후 마땅히 갈데가 없어서 지난주에 한번 갔구~오늘은 집밥이 지겨워서 갔는데 양파절임이 없어서 달라고 하니 셀프(퉁명스런말투)라고 하다가 첨은 갔다준다네요~ 또 달라고 하면 기분언잖게 할까봐 셀프바에 가니 양파절임이 없다고 하니 그제서야 리필해 주는데 얻어 먹으러 간것도 아니고 내돈 내고 먹는데도 이런 하찮은 대접을 받아야 하는건지~ 계산할때도 그렇고~불친절한 말투 냉냉한 행동 다시는 오지 말라는거 맞죠?|몇년전 갔을때도 평범하네했는데다시 가서도..더 맛이 없어진듯면양이 많다는 장점외에는 그닥..쌀국수 국물 깊은 맛없고 밍밍팟타이도 그닥..업체지원 리뷰가 많아서 의심스러웠는데다시 갔어도 그닥이었음.||쌀국수 넘 맛있어요!! 직원분들도 항상 친절하세요🥰|와이프 조리원 근처에서 맛집을 찾았네요. 잘먹었어요.|여기 완전 괜찮아요쌀국수도 밥도 갈때마다 만족해요무엇보다 주방 깨끗한게 그냥 음식 보면 다 느껴짐|큐브스테이크덮밥존맛친절강추마라쌀국수포아델 쌀국수완탕도존맛|사장님이 바뀌어서 그런지 한 겨울 날씨에 예전처럼 따뜻한 쟈스민차도 없다고 하고, 한창 점심 시간대에 쌀국수 먹으러 갔는데 고기 삶느라 지금 쌀국수 못해준다 하고 예전보다 좋아진 거 하나도 모르겠음. 게다가 가격도 더 비싸지고... 점심 시간에 쌀국수 집에서 쌀국수를 못판다 하는게 말이 되는 건지 싶은 황당한 기분. 몇 년 단골이었는데 오랜 친구를 잃어버린 느낌이었달까...|화이트톤의 깔끔한 인테리어음식이신선함"
스트릿 현대백화점판교점,2.6,성남시 분당구 판교역로146번길 20 지하1층,"아… 가지볶음밥 하시던 요리사님은 그만 두셨나봐요. 소울이 없어진 맛 ㅠ 가끔 생각나서 일부러 와서 먹곤 했는데… 마라탕 그것도 없어지고.. 꿔바로우 소스도 전보다 형편 없네요. 돈아까워서 그냥 다 먹었어요. 다신 안올듯.|두번째 방문인데 가지덮밥 파이구 볶음밥 맛있게 먹었네요가성비는 안 바라고 중독적인 맛이라 또 찾았습니다세번째 방문에 완탕쌀국수 싱겁고 면은 다 불어있음|마늘쫑돼지고기 덮밥 먹었는데 진짜 심각하게 달고 짭니다. 간장을 엎어서 짠맛 가리려고 설탕을 들이부었나 싶을정도로요. 혀가 아려요. 밥만 좀 먹다 남겼네요. 푸드코트 방식인데 자리 닦아주는 직원도 없고 음식나오는데 20분 걸렸어요. 참고하세요|살면서 먹어본 쏨땀 중 최악…. 세상에 없는맛|백화점 지하푸드치고 너무 오래기다려야하고 맛도 별로에요 크림새우 튀김옷도 너무 두껍고 속까지 다안익힘 맛없어요|매니저 진짜 불친절하다 포장주문했는데 약속시간 보다 10분이상 지연시켜놓고 미안하다고 말한마디 안하고 설명도 안하고 퉁명스럽게 무표정으로 표정썩어서 음식주네|꽤 맛있네요. 새우는 3개? 정도 들어있었던거같어요. 밍밍할까봐 걱정했는데 맛있어요. 혼밥하기도 좋아요. 추천!메뉴: 새우완탕쌀국수 9,300원|spc것 치고 기대보다 맛남|가지덮밥이랑 꽃빵 멘보샤가 맛있음. 쌀국수는 약간 애매.|시그니처세트. 비주얼에 비해 간과 맛이 심심함. 그것보다 더 별로는 매니저인지 퉁명스러워서뭐지 싶어 기분망침. 그 사람만 아니었으면 보통맛이었을지도.|댓글에 다들 뭐하시는 분들이세요?? 가지덮밥 먹어보고 평을 하세요!! 모든걸 상쇄시키는 존맛이에요!!!|최근 먹어본 일본 라면중 최악입니다. 레토르트가 더 맛있을 것 같아요. 맛도 없지만 음식 받으러 갔는데 쳐다도 안 보는 서비스도 최악입니다. 손님이 음식 받으러 오면 인사는 안해도 어떤 쟁반을 가져가야되는지 정도는 알려줘야하지 않겠습니까?|음식도 그냥 그런데 직원분들 교육을 다시하셔야할것같아요. 손님을 대하는 태도가 너무 예의없어요.|비쌈. 카운터 백화점 서비스 교육이 필요한듯|우육면이랑 쌀국수맛이 변했네요 ㅠ 덜 깊어지고 짜진 느낌..다음에 한번 더 와서 먹어봐야겠네요. 대만 생각나고 좋았는데..|맛있네요|마라우육탕면 먹어봤는데 고기가 크고 괜찮았어요~|비싸고 면은 별로"
메콩타이 수내점,4.0,성남시 분당구 백현로101번길 17,맛있었어요~||친절하고 만족스러운 식사였어요.|팟타이 나시고랭은 단맛만 나고공심채 볶음은 양념과 재료가 따로 노는 느낌이 강하다.제일 맛있게 마신건 기본제공 자스민차이다.기대하지말고 가자.|정말 양이 많기 때문에 쌀국수 같은 경우에는 라지 시키려면 정말 신중해야 함. 맛에 있어서도 분당 지역 쌀국수집들 중에서 단연 최고라고 생각함.|월남쌈 푸짐하게 잘 먹고 갑니다.|
국수나무 분당삼평점,5.0,성남시 분당구 판교로 372 2층 201호,푸짐하고 맛있음|냉국수|여러번 방문해서 식사하고 있어요! 사장님도 너무 친절하시고 주메뉴인 국수 말고 다른 메뉴들도 맛있어요🙂 입소문 나서 더더더 잘되셨음 좋겠어요|사장님 너무 친절하시고 쌀국수 깔끔하게 맛있어요!!☺️단무지도 직접 담그신다고 했는데 건강하게 상콤했어용|
사이공본가 미금점,1.4,성남시 분당구 돌마로 47 이코노샤르망 102호,마감을 9시에 할거면 영업시간을 바꾸세요 8:50에 갔는데 못먹음|손님 응대: 0점위생 및 청결: 바닥과 테이블 좀 닦으세요.음식: 가격이 착하다고 음식이 별로면 좋아할까요?죄송하지만 지인에게 추천하고 싶진 않은 음식점.|알바생 주방에서 양치하고 마스크 안낀채 기침하는 거 보고 기함.. 위생 최악|가성비 좋네요. 3.3점 입니다|싼마이로 간다지만.. 너무 별로임 위생.맛 뭐하나 제대로된게없는.. 그냥 저렴하게 배채우실분들은 괜찮을수도..
조이포 판교점,5.0,성남시 분당구 대왕판교로 660 유스페이스 A동 1층 127호,"우연히 야근하다 볶음밥 주문해먹었엇는데 맛있게 먹었어서어제 퇴근길에 볶음밥 포장했습니다.진짜 사장님(?)직원분들 다들 너무 친절하셔서 기분좋았어요.맛은 뭐 당연히 맛있게 먹었고요.번창하세용!|사장님 두 분 모두 진짜 친절하시고 좋아요맛도 전반적으로 다 괜찮습니다|여기 다른메뉴보다 쌀국밥이 독특하구 맛남|판교 테크노밸리 쌀국수집 중에서 제일 나음맛과 양, 가격 모든면에서.|우연히 들어갔는데 맛집이었네요."
조이포베트남쌀국수,0.0,성남시 분당구 대왕판교로 660, 
맘맘테이블 분당직영점,5.0,성남시 분당구 황새울로214번길 8 1층,|현지맛그대로 바로 위 2층 체인보다 훨씬 나아요가격도 싸고|매운쌀국수? 토마토맛나고 이색적이고 맛있어요! 또갈듯ㅎㅎ+ 2024.04. 또갔습니다 ^^|호불호 없을 맛이면서도 여기만의 특색이 있어서 너무 맛있음!! 고기말고도 피쉬볼 메추리알 이런 것들도 들어있어서 너무 좋음... ☆면 다 먹으면 밥 추가하고 다진마늘 완전마니 때려넣어서 국밥같이 먹으면 죤맛...☆||분팃능(비빔국수) 너무 맛있게 먹었습니다 ㅎㅎ|베트남 현지보다 더 맛있는집.아쉬운점-->메뉴가 너무 단촐해서 선택권이 좁음.|넘 맛있음...빨리 나와서 후딱 먹기도 좋음또 먹고싶다.......호띠우에 태국고추랑 마늘 고수 넣어서 자셔보세요들||양 많아요. 맛있어요. 친절해요. 짖짜어떳해요너뮤맛잇어요||
뽀짜이빤,4.0,성남시 분당구 정자일로 197,연태하이볼 맛있습니다!|가볍게 먹으며 맥주한잔 하기 좋아요. 솥밥 맛있어요.||시켰던 메뉴 중에 볶음밥 빼고 다 맛잇었어요  가격도 부담없는 편이|훠궈세트랑 특히 연태하이볼 추천해용ㅎㅎ|ㅁ|매우 맛있어요. 특히 가리비는 최고!!|훈툰면 만두 맛있는데 만두 메뉴는 없네요 아쉽..짜요 짜도 너무 짬|맛있고 홍콩분위기가 좋음. 22.07.25 기준 오리 한마리 6만원.|소스 양배추 양파 고기 전부다 조금 들어있어서 창렬함특색있는 음식도 레시피도 아님 왜 홍콩식인지 모르겠음 비추천|너무 맛있어요! 한국에서는 찾아볼 수 없는 광식뽀짜이빤 식당!
만복국수,2.3,성남시 분당구 정자일로 100,"한줄평: 태어나서 먹어본 국수 중에 가장 이상한 국수와 태어나서 먹어본 김치 중에 가장 맛있는 김치, 그리고 맛있는 보쌈. 1) 면이 최악 / 2) 국물이 감칠맛 1도 없이 개밍밍 / 3) 식탁에서 쉰내남(크린콜로 안닦고 그냥 행주 계속 쓰시나봄)동네주민인데 지나다니기만했지 오늘 처음 가봄. 누가 압구정에 있는 지점 맛있다고하길래 오늘 가서 멸치2인+보쌈 세트 시켰음. 근데 한입 딱 먹는데 면이 진짜 개이상한거임. 뭐지…? 소면이 안익은건가. 뭐지 이 꼬들꼬들하고 소화안될거같은 곤약면 재질의 이상한 식감은…? 1차 당황. 남친이랑 머리를 싸매고 고민하기 시작함. 면이 왜 이럴까. 벽면 메뉴판을 다시 자세히 봄. 멸치<쌀>국수라고 적혀있음. 아니 멸치국수가 일반적인 소면이 아니라 쌀국수면을 소면처럼 얇게 뽑은 멸치쌀국수 였던거임. 근데 쌀국수면이 넓적하고 부드러울 때나 맛있는거지 소면 굵기로 뽑아놓으니까 완전 대박 구림. 국물도 멸치육수 100 하시면서 자부심 크시던데 내입맛에는 영 아니었음. 뭔맛이냐면 그 집에서 멸치육수를 뽑으셈 거기다가 국간장을 좀 타셈. 딱 그맛임. 멸치육수인건 알겠는데 그래도 어느정도 감칠맛이 나야지 너무 정직한 육수 그자체임ㅠㅠ. 근데 문제는 김치랑 보쌈이 개맛있음. 아 보쌈이 하나도 안느끼하고 ㄹㅇ 개존맛탱임. 그래서 딜레마에 빠짐. 국수는 최악이지만 보쌈만을 먹으러 재방문할 가치가 과연 있을까. 그리고 김치가 와 뭐 이런 김치가 있지. 김치가 미쳤음!ㅋㅋㅋㅋ아직 고민중임. 근데 김치전은 별로일듯 옆테이블꺼 보니까 바삭바삭한 느낌이 ㄹㅇ 1도 없었음.|거래처 사람이 데려갔는데분위기도 좋고 맛도 있네요 ㅎㅎ보쌈 해물파전 동동주에비빔국수 입가심으로 시켰는데비빔국수 ㅈㅁㅌ...... 추릅...|정말 맛없음 헛웃음이 나올지경|아오...맛... 무슨...하아...|체인점이라 맛이 다 똑같을줄 알았는데... 전혀 아니네요 ㅠ 판교점 만복국수집 맛 생각하고 정자점 가봤는데... 완전 달라요 맛도 다르고 면발도 전혀 다르고.. ㅠㅠ 두번다시 가고 싶지 않아요.. 판교점은 진짜 맛있는데...|가야는 이유 : 회사에서 가재서, 전은 괜찮안가는 이유 : 싸다는 느낌은 안듦|체인점|런치로 싸게 먹을 수 있는 맛집. 멸치국수는 안먹어봤지만 비빔국수는 평범"
슈퍼타이 그레이츠판교점,3.8,성남시 분당구 분당내곡로 117 지하1층 102호,"|태국에서 먹는 느낌똠양쌀국수 시켰는데 양이 푸짐해서 결국 좀 남겼어요|주차는 다른 지점에 비해 편해서 좋았습니다.맛은 괜찮았는데 다른 지점이 제 입맛에는 더 맞았어요.|방문날짜 : 24.06.05 / 24.06.12주차 : 그레이츠 판교건물내 주차 널널쓰맛 : 쌀국수는 국물이 맑은데 맛나고 요리조리 조합해먹는 맛이있음 / 비빔은 간이 되어있는데 새콤한 비비임(허멀건해서 잘못나온줄) / 계란 양념이랑 껍데기부분 맛남 / 족발 야들야들 밥이랑먹어야함- 여자알바생 혼자라서 바뿌시지만 친절 /저녘엔 자리있는편 / 난 내장좋아하는데 안좋아하면 불호일듯( 쌀국수, 비빔쌀국수에 내장들어가있음)|가격 대비 양도 너무 적고, 굳이 이 돈 주고 먹어야 할 지는 의문이었어요. 그냥 현백에 까폼 가는게 나을듯푸팟퐁 커리 무슨 아동용 시킨 줄 알았어요쌀국수도 많이 식어서는 플라스틱 그릇에 나오는 것도 별로였음...|팟타이랑 똠양쌀국수 먹었는데, 둘다 음, 무늬만 팟타이, 똠얌 느낌;0; 면 양은 많긴하다|본점보다 양은 좀 적어진듯하지만, 맛은 비슷했어요. 좁아서 점심엔 일찍 안가면 대기해야해요|똠얌쌀국수에 정체모를 고기 빼줬으면.. 이전처럼 해산물 넣어줬으면..여긴 역시 팟타이 👍👍👍|다른지점 슈퍼타이 가보고 첨 방문했는데 맛있었어요 다음에도 생각나면 들려야쥐..|판교역 주변에도 생겨서 반가운 슈퍼타이! 다들 기다리셨는지 점심 웨이팅이 어마어마어마무시. 좋아했던 똠양쌀국수는 해산물이 아니라 고기 토핑으로 바뀌어서 뭔가 신기했구요? 양이 전보다 좀 적어진것 같긴 함니당|로컬맛 그자체|다른 지점보다 맛도 서비스도 별로. 대기하며 먹을 정도 아님.|그레이츠판교점 생겨서 너무 좋아요|"
사이공 핫팟,3.7,성남시 분당구 정자일로 120,"|사장님도 엄청 친절하시고 양 엄청 많아요 육향이 엄청 진해요 해산물 쌀국수는 메뉴에서 없어져서 아쉽|여기 쌀국수 맛있어요 숨은 맛집인 거 같아요양지 쌀국수 국물이 맑고 해장으로 딱 좋아요|메뉴 전체적으로 다 맛있어요!|쌀국수 그냥 그래요. 알바아줌마 알바이면서 먼가 거만하고 행동이 좀 예의없으신듯.. 다신 안가요.|진짜 분당 맛집압니다 이쁜  사장님  ,,,재료  신선 청결하고 분위기 넘 좋아요 언제나 가도 분위기 up 되요|유튜버 옆집형 촬영지하노이 볶음밥 강추~♡살짝 매콤에 고수향이 매력적^.....^|쌀국수 노맛|맛있었지만 쌀국수집은 어딜 가든 평타는 쳐서 특별한 느낌은 없었음||Phở Rice Noodle|메콩타이 먹으면 너무 칼칼하여 사이공으로||쌀국수를 먹을 줄 몰라서인 지는 몰라도 대부분 음식이 싱겁고 맛이 평범한 수준이다|쌀국수 여기가 젤 맛있는 듯|나에게 베트남 음식이 좋아지게 만든 집 앞의 작은 가게."
살라타이,3.4,성남시 분당구 정자일로 100,맛있어요. 똠양꿍과 가이팥 매드 마멍(닭가슴살 아채 캐슈넛 볶음) 갈 때마다 먹어요|맛: 4.5 서비스: 2가격: 1  일요일 분당에 나갈일이 있어 나갔디 오는 길에 아내와 갑자기 태국 음식이 먹고 싶어 검색했는데 대부분 문이 닫아 몇군데 검색하고 오게된 곳인데 맛은 괜찮은 편이나 가격이 너무 심하게 비쌌습니다. 옐로우 커리에 만팔천원  팟타이 만육천원인데 양도 많지 않은데다가 옐로우 커리에는 심지어 밥도 같이 나오지 않음. 주문할때 밥은 안 나온다 그래서 당연히 팻타이에는 밥이 안나온다는 걸로 이해했는데 옐로우 커리에 밥이 안 나온다는 거였음 (아직도 이해가 안됨) 그래서 밥 추가 주문 함 (2천원) 비싸면 양이라도 많아야하는데 나와 아내 적게 먹는 편인데도 약산 모자란 느낌... 총평: 맛은 상당히 좋으나 가격이 너무 비싸다. 이 가격을 알고 다시 오지는 않을 것 같다.||남만 호이 락카오 볶음밥 맛있습니다. 추천합니다. 가성비는 떨어집니다.|비쌈. 맛에비해 가성비가 매우않좋음.|브레이크타임을 좀 적어두시는게 좋을 것 같아요…ㅠ 허탕치고 왔네욤 ㅠ|요즘(2022.07) 점심시간에 사람 엄청 많아요.(자리 꽉참)점심 먹으면서 이야기 하기에 너무 시끄러워요. 음식은 언제나 맛있어요. 메뉴 이름은 어렵지만 새로운 메뉴 발견하는 재미가 있어요.||똠냠꿍은 맛있어요! 똠냥쌀국수만 먹으러 갈듯.푸팟퐁커리는 간이 슴슴해서 호불호가 있을 것 같은데저는 불호...||일요일 12시 50분경 방문. 손님들 여러명 몰려온듯 음식은 없고 바글거렸다. 사장님은 없고 알바만 있었던듯. 우리도 5명이라 옆에 테이블셋팅 5명 되있는 자리를 가르키며 여기 앉아도되냐고 묻는말에 1번 본체만체 대답도 안함. 다시한번 물었는데 돌아오는대답 안되요. 분명 짜증나고 귀찮은건 알겠는데 서비스업에서 그 자리는 좁아서 안될것같네요 라는 말 안하고 그냥 짜증나는식으로 안되요라고 하면 어느음식점이든 손님 잃기 마련이다. 맛있고 나름 동네라서 금액이 비싸도 자주 방문 하였는데 이런식이라면 동네에 있는 흔한 패스트푸드지점보다도 서비스가 못하다고 생각이된다. 별 1개도 아깝다.|맛맛 근데 카레 양이 좀 적어요|
아시아티크,4.2,성남시 분당구 서현로239번길 1 1층,태국 음식 좋아해서 여기저기 먹으러 다니는데 단연코 1등으로 뽑고 싶어요약간 정통은 아닌듯하면서 맛을 너무 너무 잘 잡으시네요총 네 가지 먹어봤는데 전부 맘에 들었고다른 메뉴 먹어보기 위해 조만간 또 가려고요인테리어도 신경 쓴 티가 나고요정말 만족스러운 시간이었어요|오리엔탈 가든 자리에 리모델링 후 새로 생긴 동남아 음식점이에요! 같은 사장님이 가게 이름만 바꾸셨나했는데 아예 바뀌었더라고요! 맛있었어요.사장님 피셜 월요일 빼고 영업하신대요!저 카레 진짜 맛있어요 강추합니다!|맛없어요|소프트크랩커리와 팟타이 맛나게 잘 먹었어요!|존맛이긴 한데 가격대가 점심에 먹기에는 좀 부담되는 건 사실|창가에서 먹었는데 분위기는정말 태국식당에서 먹는줄~~그러나 맛은 약간아쉬워~ 그래도 태국이그리울땐..고고?||가격대에 비해서 일반 쌀국수 맛이 너무 아쉬웠어요...ㅠㅠ 기본적으로 맛이 너무 밍밍해서 드실 거라면 소스 많이 추가하셔서 드셔야 할 것 같습니다... 그리고 소스바 있는 쪽이 너무너무 끈적거려서 갔다오면 신발 바닥이 쩍쩍 달라붙던데 이 부분 조금만 신경써주셨으면 좋겠어요...|이런 다 먹고 사진을 찍었네. 좀 맵지만 밥도둑임|이 집은 무슨 일 있었나? 무지 맛있는데 점심때 왜 한가하지? 쏨땀이랑 공심채볶음이랑 곱창국수 먹었는데 꽤 잘함.|쌀국수(이름 까먹음 ㅠ)랑 새우커리 먹었는데. 쌀국수는 국물이 정말 맛있고 고기도 많이 들어있어서 해장에 아주 좋았습니다.  새우 커리는 특제 비법소스? 라고 하셨는데 정말 기억에 남아서 리뷰 씁니다. 요리를 정말 잘하시는 듯. 이집 카레 메뉴 꼭 드셔보세요. 다음에 다른 메뉴도 먹어보러 또 갈게요.|분위기가 현지에 있는듯한 느낌이랄까?엄청좋아요
까몬 서판교점,4.7,성남시 분당구 운중로 121,|베트남 현지 바이브가 느껴짐.|맛도 양도 혜자
사이공키친,4.4,성남시 분당구 성남대로 393,사장님 바뀌셨는지 양도 줄고 맛도 변했네요||점심시간 바쁘실텐데도 빨리 나오고 맛나요. :)속이 메슥거릴때마다 당기는 쌀국수 국물맛때문에 점심시간마다 찾아가게 되는거같습니다:)|맛있습니다. 팟 카파오 간단한 구성이지만 쟤료들의 퀄리티랑 맛이 좋습니다. 밥의 질이 매우 높습니다.|양도 많고 맛있어요. 고기가 뒤덮여있어 고기가 엄청 많아보이지만 얇아서 많은건 아녜여. 그래도 동네 생각하면 가성비 괜찮습니다|양 푸짐하고 가격도 요즘 물가 생각하면 진짜 완전 적당한 가격이구 짜고 달지 않은 담백한 쌀국수와 스프링롤맛있습니다!|주 1회 팟타이 먹어야 하는 찐찐찐 맛집 입니당 동남아 갈 필요가 웂어요|맛있습니다^^|여기 집에서 가까워서 자주가는데... 진짜 알차고 맛있어요! 계속 그자리에 있어주세용||닭날개 맛있고 쌀국수 맛있어요!! 팟타이는 약간 평범||무난합니다작은 집이고 조용합니다|여기 맛나당ㅎㅎ 닭고기 쌀국슈♥️
